{"synchronization_evidence_schema_version":"1.0.0","session_id":"3f1c2a90-7b45-4c8e-9d21-6a0e5b4c3d27","manifest_session_id":"3f1c2a90-7b45-4c8e-9d21-6a0e5b4c3d27","video_role":"session_video","video_path_ref":"media/session.bin","video_sha256":"c4138ded2ac772be6298942de4bace8a87c2143959702b524db9f3a773b5a901","video_byte_length":16,"raw_pose_stream_path_ref":"frames.ndjson","raw_pose_stream_sha256":"42f97597bda8120eaed9a0bb1e311f3327e0bb14c258f07ea6c0de9ee51e2ba5","container":"video/mp4","codec":"c2.qti.avc.encoder","camera_timestamp_domain":"android_elapsed_realtime_nanos_rebased","encoder_timestamp_domain":"container_presentation_time_us","mapping_method":"camera_capture_to_container_pts_constant_offset_v1","container_offset_ns":1000000000,"container_drift_ns_per_s":0,"video_pts_us":[0,33333,66666],"samples":[{"frame_index":0,"rebased_capture_timestamp_ns":1000000000,"submitted_pts_us":1000000,"demuxed_pts_us":0},{"frame_index":1,"rebased_capture_timestamp_ns":1033333000,"submitted_pts_us":1033333,"demuxed_pts_us":33333},{"frame_index":2,"rebased_capture_timestamp_ns":1066666000,"submitted_pts_us":1066666,"demuxed_pts_us":66666}],"first_camera_frame_timestamp_ns":1000000000,"last_camera_frame_timestamp_ns":1066666000,"first_encoded_frame_pts_us":0,"last_encoded_frame_pts_us":66666,"first_pose_capture_timestamp_ns":1000000000,"last_pose_capture_timestamp_ns":1066666000,"counts":{"delivered_camera_callbacks":3,"encoded_video_frames":3,"submitted_inference_frames":3,"emitted_pose_records":3,"dropped_before_encoder":0,"encoder_failures":0,"inference_skipped_frames":0,"inference_failures":0},"producer_git_sha":"0000000000000000000000000000000000000005","device_model":"SM-S938B","device_api_level":36,"device_abi":"arm64-v8a"}
